{
  "$schema": "https://json-schema.org/draft/2020-12/schema",
  "$id": "https://design-machines.local/workflow-kernel/improvement-input-index-v1.schema.json",
  "title": "Improvement Input Index v1",
  "type": "object",
  "additionalProperties": false,
  "required": ["schema_version", "record_kind", "run_id", "feature_slug", "sealed_at", "inputs", "inspected_count", "index_digest"],
  "properties": {
    "schema_version": {"const": 1},
    "record_kind": {"const": "improvement-input-index"},
    "run_id": {"$ref": "#/$defs/id"},
    "feature_slug": {"$ref": "#/$defs/id"},
    "sealed_at": {"$ref": "#/$defs/timestamp"},
    "inputs": {
      "type": "array", "maxItems": 256,
      "items": {
        "type": "object", "additionalProperties": false,
        "required": ["evidence_id", "artifact_ref", "artifact_digest", "source_run", "source_stage", "source_chunk", "observation_category", "observed_at", "classification_rule", "availability", "redaction_status"],
        "properties": {
          "evidence_id": {"$ref": "#/$defs/id"},
          "artifact_ref": {"$ref": "#/$defs/text"},
          "artifact_digest": {"$ref": "#/$defs/digest"},
          "source_run": {"$ref": "#/$defs/id"},
          "source_stage": {"$ref": "#/$defs/id"},
          "source_chunk": {"oneOf": [{"$ref": "#/$defs/id"}, {"type": "null"}]},
          "observation_category": {"$ref": "#/$defs/id"},
          "observed_at": {"$ref": "#/$defs/timestamp"},
          "classification_rule": {"$ref": "#/$defs/id"},
          "availability": {"enum": ["available", "unavailable"]},
          "redaction_status": {"const": "approved_safe_reference_only"}
        }
      }
    },
    "inspected_count": {"type": "integer", "minimum": 0, "maximum": 256},
    "index_digest": {"$ref": "#/$defs/digest"}
  },
  "$defs": {
    "id": {"type": "string", "pattern": "^[A-Za-z0-9][A-Za-z0-9._:-]{0,255}$"},
    "text": {"type": "string", "minLength": 1, "maxLength": 4096},
    "digest": {"type": "string", "pattern": "^sha256:[0-9a-f]{64}$"},
    "timestamp": {"type": "string", "pattern": "^[0-9]{4}-[0-9]{2}-[0-9]{2}T[0-9]{2}:[0-9]{2}:[0-9]{2}(?:\\.[0-9]+)?Z$"}
  }
}
