{"feature_slug":"depot-mechanical-workflow-hardening","index_digest":"sha256:7dca55da30d8466502bf4071f44c2140f4dcafc7fde62f2d58faa475d3d2f9c2","inputs":[{"artifact_digest":"sha256:fa0b37e2c02429576892e432c89141dc7b13c5e38c09e61effe1a3f36d626656","artifact_ref":"plans/depot-mechanical-workflow-hardening/final-dm-review.md","availability":"available","classification_rule":"safe_redacted_markdown","evidence_id":"final.review.owned","observation_category":"review_findings","observed_at":"2026-07-22T17:30:23Z","redaction_status":"approved_safe_reference_only","source_chunk":null,"source_run":"depot-mechanical-workflow-hardening","source_stage":"final_review"},{"artifact_digest":"sha256:67a113085b71dc64454ddc67976bf3ae47a6ab254cd33c2e0ecef5b75654e81b","artifact_ref":"plans/depot-mechanical-workflow-hardening/run-postmortem.md","availability":"available","classification_rule":"safe_redacted_markdown","evidence_id":"postmortem.current","observation_category":"run_recommendations","observed_at":"2026-07-22T17:30:23Z","redaction_status":"approved_safe_reference_only","source_chunk":null,"source_run":"depot-mechanical-workflow-hardening","source_stage":"postmortem"},{"artifact_digest":"sha256:58aade0fe150261334353af693aff890bb01a9f17d2b2f1c834a7ed943c9d959","artifact_ref":"plans/adaptive-fusion-verification/run-postmortem.md","availability":"available","classification_rule":"safe_redacted_markdown","evidence_id":"postmortem.prior","observation_category":"run_recommendations","observed_at":"2026-07-22T07:23:07Z","redaction_status":"approved_safe_reference_only","source_chunk":null,"source_run":"adaptive-fusion-verification","source_stage":"postmortem"},{"artifact_digest":"sha256:1706bdfe1086f8aee81edb8d5a94c6eefeeef41c5b7b156fe57dc48e1ab5db27","artifact_ref":"plans/depot-mechanical-workflow-hardening/receipts/06-assembly-repository-profile.json","availability":"available","classification_rule":"safe_redacted_json","evidence_id":"provider.privacy.fallback","observation_category":"provider_fallback","observed_at":"2026-07-22T16:24:56Z","redaction_status":"approved_safe_reference_only","source_chunk":"06-assembly-repository-profile","source_run":"depot-mechanical-workflow-hardening","source_stage":"dispatch"},{"artifact_digest":"sha256:843523c724cc8cf4fedcfcf6cbc32027594d2290c74987709caa6912ea130268","artifact_ref":"plans/depot-mechanical-workflow-hardening/final-requirements-crosscheck.md","availability":"available","classification_rule":"safe_redacted_markdown","evidence_id":"requirements.final","observation_category":"requirements_evidence","observed_at":"2026-07-22T17:30:23Z","redaction_status":"approved_safe_reference_only","source_chunk":null,"source_run":"depot-mechanical-workflow-hardening","source_stage":"requirements_crosscheck"},{"artifact_digest":"sha256:95f988869db69cebf7391474acc537766ad3bc1bb5ef6fd887b08f964df1ada2","artifact_ref":"plans/depot-mechanical-workflow-hardening/pipeline-shadow-observation.json","availability":"available","classification_rule":"safe_redacted_json","evidence_id":"shadow.all_chunks","observation_category":"shadow_binding_gap","observed_at":"2026-07-22T16:57:06Z","redaction_status":"approved_safe_reference_only","source_chunk":null,"source_run":"depot-mechanical-workflow-hardening","source_stage":"shadow_observation"}],"inspected_count":6,"record_kind":"improvement-input-index","run_id":"depot-mechanical-workflow-hardening","schema_version":1,"sealed_at":"2026-07-22T17:30:23Z"}
